{
  "schema_version": "2.0",
  "protocol_id": "cart-d10-it0",
  "request_id": "cart-d10-001",
  "iteration": 0,
  "parent_protocol_id": null,
  "revision_brief_id": null,
  "changes_from_parent": [],
  "title": "Rocking-bag CAR-T expansion to day 10, unedited vs EXH1 knockout (iteration 0)",
  "label": "SYNTHETIC FIXTURE: built from a synthetic source. Not a validated protocol and not clinical or manufacturing guidance.",
  "day_origin": "T cell seeding and activation",
  "evidence": {
    "handoff_paths": [
      "examples/cart/handoff.it0.synthetic.json"
    ],
    "source_protocol_ids": [
      "SYNTH_cart_rockingbag"
    ],
    "notes": "Synthetic fixture claims c01-c14"
  },
  "insights": [
    {
      "insight_id": "I1",
      "statement": "The source process activates for 48 h, transduces on day 2 and harvests on day 10, which matches the day-10 question directly.",
      "claim_ids": [
        "c02",
        "c07",
        "c09"
      ],
      "evidence_level": "direct_same_cell_type",
      "relevance": "Fixes the schedule and the harvest day."
    },
    {
      "insight_id": "I2",
      "statement": "No evidence for EXH1-specific culture requirements was found within the initial search budget, so the knockout arm runs the same schedule as the control and its behaviour is a hypothesis to be measured.",
      "claim_ids": [],
      "evidence_level": "none",
      "relevance": "Both arms start identical, which is what makes the comparison interpretable."
    }
  ],
  "culture_system": {
    "format": "rocking_bag",
    "vessel": "single-use rocking bag",
    "working_volume": {
      "value": 100,
      "unit": "mL",
      "provenance": "reported",
      "claim_ids": [
        "c15"
      ],
      "rationale": null
    },
    "parameters": {
      "feed_fraction": {
        "value": 0.5,
        "unit": "fraction",
        "provenance": "reported",
        "claim_ids": [
          "c05"
        ],
        "rationale": null
      },
      "temperature": {
        "value": 37,
        "unit": "degC",
        "provenance": "design_choice",
        "claim_ids": [],
        "rationale": "Standard culture temperature; not stated in the source."
      }
    }
  },
  "stages": [
    {
      "stage_id": "t_cell_activation",
      "name": "Activation",
      "start_day": 0,
      "end_day": 2,
      "medium": {
        "value": "serum-free T cell medium",
        "unit": "text",
        "provenance": "adapted",
        "claim_ids": [
          "c01"
        ],
        "rationale": "Medium named in the context of claim c01; composition not extracted."
      },
      "goal": "Stimulate the T cells into cycle and establish cytokine support",
      "steps": [
        {
          "step_id": "S01",
          "day": 0,
          "end_day": null,
          "action": "seed",
          "factor": null,
          "quantity": {
            "value": 1000000,
            "unit": "cells/mL",
            "provenance": "reported",
            "claim_ids": [
              "c01"
            ],
            "rationale": null
          },
          "description": "Seed donor T cells into the rocking bag"
        },
        {
          "step_id": "S02",
          "day": 0,
          "end_day": 2,
          "action": "add_factor",
          "factor": "anti-CD3/CD28",
          "quantity": {
            "value": 1,
            "unit": "dimensionless",
            "provenance": "reported",
            "claim_ids": [
              "c03"
            ],
            "rationale": null
          },
          "description": "Activation reagent at a bead-to-cell ratio of 1"
        },
        {
          "step_id": "S03",
          "day": 2,
          "end_day": null,
          "action": "remove_factor",
          "factor": "anti-CD3/CD28",
          "quantity": null,
          "description": "Wash out the activation reagent; this step's day sets the stimulation length"
        },
        {
          "step_id": "S04",
          "day": 0,
          "end_day": 10,
          "action": "add_factor",
          "factor": "IL-2",
          "quantity": {
            "value": 100,
            "unit": "IU/mL",
            "provenance": "reported",
            "claim_ids": [
              "c04"
            ],
            "rationale": null
          },
          "description": "IL-2 from activation through to harvest"
        }
      ]
    },
    {
      "stage_id": "transduction",
      "name": "Transduction",
      "start_day": 2,
      "end_day": 3,
      "medium": {
        "value": "serum-free T cell medium",
        "unit": "text",
        "provenance": "adapted",
        "claim_ids": [
          "c06"
        ],
        "rationale": "Same medium as activation; no separate transduction medium reported."
      },
      "goal": "Deliver the CAR transgene",
      "steps": [
        {
          "step_id": "S10",
          "day": 2,
          "end_day": null,
          "action": "add_factor",
          "factor": "lentiviral vector",
          "quantity": {
            "value": 1,
            "unit": "dimensionless",
            "provenance": "reported",
            "claim_ids": [
              "c06"
            ],
            "rationale": null
          },
          "description": "Vector at a multiplicity of infection of 1, added on day 2"
        }
      ]
    },
    {
      "stage_id": "expansion",
      "name": "Expansion and harvest",
      "start_day": 3,
      "end_day": 10,
      "medium": {
        "value": "serum-free T cell medium",
        "unit": "text",
        "provenance": "adapted",
        "claim_ids": [
          "c08"
        ],
        "rationale": "Same medium maintained through expansion."
      },
      "goal": "Expand to the target dose while holding viability",
      "steps": [
        {
          "step_id": "S20",
          "day": 4,
          "end_day": 10,
          "action": "feed",
          "factor": null,
          "quantity": null,
          "description": "Half-volume medium addition whenever the density approaches the bag limit (see culture_system.feed_fraction)"
        },
        {
          "step_id": "S21",
          "day": 7,
          "end_day": null,
          "action": "sample",
          "factor": null,
          "quantity": null,
          "description": "Mid-expansion count and viability"
        },
        {
          "step_id": "S22",
          "day": 10,
          "end_day": null,
          "action": "harvest",
          "factor": null,
          "quantity": null,
          "description": "Harvest, count, CAR detection and release sampling"
        }
      ]
    }
  ],
  "genotype_arms": [
    {
      "arm_id": "WT",
      "genotype": "wild_type",
      "gene": null,
      "modification": null,
      "zygosity": "not_applicable",
      "line_id": "SYNTH-D01",
      "description": "Unedited donor T cells"
    },
    {
      "arm_id": "EXH1_KO",
      "genotype": "knockout",
      "gene": "EXH1",
      "modification": "CRISPR-Cas9 frameshift (placeholder gene name for this synthetic fixture)",
      "zygosity": "homozygous",
      "line_id": "SYNTH-D01-EXH1-KO",
      "description": "Isogenic knockout of a placeholder exhaustion-associated gene"
    }
  ],
  "genotype_effects": [
    {
      "effect_id": "E1",
      "arm_id": "EXH1_KO",
      "gene": "EXH1",
      "stage_id": "expansion",
      "affected_quantity": "CAR+ T cell output under the control schedule",
      "readout_metric": "target_cells_per_input_cell",
      "predicted_direction": "decrease",
      "predicted_magnitude": null,
      "mechanism": "Hypothesis only: loss of EXH1 is expected to change how the cells respond to prolonged stimulation. No direct evidence was found within the search budget.",
      "claim_ids": [],
      "evidence_level": "mechanistic_inference"
    }
  ],
  "arm_adjustments": [],
  "measurement_plan": {
    "mode": "minimal",
    "sampling_days": [
      2,
      4,
      7,
      10
    ],
    "harvest_day": 10,
    "qc_tests_planned": [
      "sterility",
      "mycoplasma",
      "endotoxin",
      "vector copy number"
    ],
    "replicates_per_arm": 1
  },
  "expected_outcomes": [],
  "open_questions": [
    "The source does not report a CAR+ fraction, so no expected transduction efficiency is carried into this protocol.",
    "Feeding is described only as a half-volume addition; the trigger density is not reported."
  ],
  "risks": [
    "One replicate per arm makes every genotype comparison directional only.",
    "Vector lot and donor variability are not represented in a single run."
  ],
  "limitations": [
    "Built from a synthetic source for software testing.",
    "A reported setting is not an optimised or validated setting."
  ],
  "approval": null
}
